Alert ID,Customer ID,Loan ID,Alert Type,Alert Date,Alert Priority,Alert Description,Follow-Up Action Required,Alert Status
1001,12345,56789,Credit Score Drop,2024-07-26,High,"John Smith, a 32-year-old male from the United States, has experienced a significant drop in credit score. His current credit score is 620, which is a 50-point decrease from the previous month. This may indicate a higher risk of default. It is recommended to review John's credit history and provide guidance on how to improve his credit score.",Review customer's credit history and provide guidance on credit score improvement,Open
1002,67890,34567,Payment Overdue,2024-07-27,Medium,"Maria Rodriguez, a 29-year-old female from Mexico, has an overdue payment of $500. Her loan is due on August 1st, and she has not made any payments in the past 30 days. It is recommended to contact Maria and remind her of the payment due date and the potential consequences of non-payment.",Contact customer and remind of payment due date and potential consequences,Open
1003,34567,89012,Credit Limit Increase,2024-07-28,Low,"David Lee, a 41-year-old male from South Korea, has been a responsible borrower and has been paying his loan on time for the past 6 months. His credit limit can be increased by 20% to provide him with more credit flexibility.",Increase customer's credit limit by 20%,Open
1004,90123,45678,Default Risk,2024-07-29,High,"Emily Chen, a 25-year-old female from China, has a high risk of default. Her loan payment history shows a pattern of late payments, and her current credit score is 580. It is recommended to review Emily's credit history and provide guidance on how to improve her credit score to avoid default.",Review customer's credit history and provide guidance on credit score improvement,Open
1005,78901,12345,Loan Maturity,2024-07-30,Medium,"Rahul Patel, a 38-year-old male from India, has a loan that is approaching maturity. It is recommended to review Rahul's loan details and provide guidance on the next steps to take after the loan matures.",Review customer's loan details and provide guidance on next steps,Open
1006,23456,67890,Credit Limit Decrease,2024-07-31,Low,"Sophia Kim, a 22-year-old female from Japan, has a credit limit that is too high. Her credit limit can be decreased by 15% to prevent over-usage and maintain a healthy credit utilization ratio.",Decrease customer's credit limit by 15%,Open
1007,56789,34567,Payment Reminder,2024-08-01,Low,"James Martin, a 45-year-old male from the United Kingdom, has a payment due on August 15th. It is recommended to send James a reminder email to ensure he makes the payment on time.",Send customer a reminder email,Open
1008,89012,45678,Defaulted Loan,2024-08-02,High,"Kevin White, a 39-year-old male from Australia, has defaulted on his loan. It is recommended to review Kevin's credit history and provide guidance on how to recover from default.",Review customer's credit history and provide guidance on recovery from default,Open
1009,12345,56789,Credit Score Improvement,2024-08-03,Medium,"Jessica Brown, a 28-year-old female from Canada, has shown significant improvement in her credit score. Her current credit score is 720, which is a 40-point increase from the previous month. It is recommended to continue monitoring Jessica's credit score and provide guidance on how to maintain a good credit score.",Monitor customer's credit score and provide guidance on maintaining a good credit score,Open
10,CR12345,12001,Overdue Payment,2022-07-25,3,"The customer has been sent multiple reminders for their overdue loan payment of $5000. The customer's account has been marked for late fees. To avoid further charges, please contact the customer to arrange a payment plan. The customer's loan was issued on 2022-01-15 with a due date of 2022-06-15. They have made 5 payments, with the last payment made on 2022-06-01. The customer's account information is as follows: Name: Ms. Fatima Ali, Age: 32, Address: 123 Oak St, Apt 4B, New York, NY 10001, USA. The customer has a credit score of 650. The loan amount is $5000 with an interest rate of 12% and a term of 60 months. The loan has been active for 6 months and has been on time for 5 of those months. The customer's income is $80000 per year and their employment status is full-time. They have been employed at IBM for 5 years. The customer has a total of 2 dependents. The customer's account balance is $3000. Please contact the customer to discuss payment options and avoid further late fees. Contact information: Phone: 555-123-4567, Email: [fali@ibm.com](mailto:fali@ibm.com).",Contact customer to arrange payment plan,Open
A001,CUS001,LOAN001,Credit Score,2023-07-26,Medium,"The customer's credit score has dropped by 50 points in the last 3 months. This is a warning sign of potential financial difficulties. The customer should review their spending habits and consider seeking financial counseling. They should also check their credit report for any errors or inaccuracies. If the customer's credit score continues to drop, we may need to consider taking further action, such as sending a collections letter or adjusting their loan terms. However, if the customer's credit score improves, we can reassess their creditworthiness and potentially offer them a better loan offer. It is essential to monitor the customer's credit score closely and take prompt action to prevent any potential financial losses.",Monitor customer's credit score and adjust loan terms if necessary,Open
A002,CUS002,LOAN002,Payment Delinquency,2023-07-27,High,"The customer has missed two consecutive loan payments. This is a serious sign of financial distress and may indicate that the customer is experiencing financial difficulties. The customer should be contacted immediately to discuss their financial situation and come up with a plan to get back on track. We should also review the loan terms and consider offering a payment extension or temporary hardship program to help the customer get back on track. If the customer continues to miss payments, we may need to consider sending the account to collections or taking other legal action. It is crucial to address this situation promptly to prevent further financial losses.",Contact customer and discuss payment plan,Open
A003,CUS003,LOAN003,Credit Limit,2023-07-28,Low,"The customer's credit limit has increased by 20% due to their excellent payment history. This is a positive sign of the customer's financial responsibility and may indicate that they are a good candidate for additional credit. The customer should be notified of the credit limit increase and encouraged to continue making timely payments. We should also review the customer's credit report and consider offering them a credit card or other credit product. If the customer continues to demonstrate responsible credit behavior, we may need to consider offering them a higher credit limit or other benefits.",Notify customer of credit limit increase,Open
A004,CUS004,LOAN004,Loan Term,2023-07-29,Medium,"The customer's loan term is nearing its end. This is a reminder that the customer should start making arrangements to repay the loan in full. The customer should be contacted to discuss their repayment plan and ensure that they are on track to meet their obligations. We should also review the loan terms and consider offering the customer a payment extension or temporary hardship program if necessary. If the customer continues to struggle with repayment, we may need to consider taking further action, such as sending the account to collections or taking other legal action.",Contact customer to discuss repayment plan,Open
A005,CUS005,LOAN005,Credit Inquiries,2023-07-30,Low,"The customer has made several credit inquiries in the past month. This is a normal part of the customer's credit building process and does not necessarily indicate any financial difficulties. The customer should be notified of the credit inquiries and encouraged to continue building their credit responsibly. We should also review the customer's credit report and consider offering them a credit card or other credit product. If the customer continues to demonstrate responsible credit behavior, we may need to consider offering them a higher credit limit or other benefits.",Notify customer of credit inquiries,Open
A006,CUS006,LOAN006,Payment Default,2023-07-31,High,"The customer has defaulted on their loan payment. This is a serious sign of financial distress and may indicate that the customer is experiencing financial difficulties. The customer should be contacted immediately to discuss their financial situation and come up with a plan to get back on track. We should also review the loan terms and consider offering a payment extension or temporary hardship program to help the customer get back on track. If the customer continues to miss payments, we may need to consider sending the account to collections or taking other legal action. It is crucial to address this situation promptly to prevent further financial losses.",Contact customer and discuss payment plan,Open
A007,CUS007,LOAN007,Credit Score,2023-08-01,Medium,"The customer's credit score has improved by 20 points in the last 6 months. This is a positive sign of the customer's financial responsibility and may indicate that they are a good candidate for additional credit. The customer should be notified of the credit score improvement and encouraged to continue making timely payments. We should also review the customer's credit report and consider offering them a credit card or other credit product. If the customer continues to demonstrate responsible credit behavior, we may need to consider offering them a higher credit limit or other benefits.",Notify customer of credit score improvement,Open
A008,CUS008,LOAN008,Payment Frequency,2023-08-02,Low,"The customer's payment frequency has increased by 10% in the last quarter. This is a positive sign of the customer's financial stability and may indicate that they are a good candidate for additional credit. The customer should be notified of the payment frequency increase and encouraged to continue making timely payments. We should also review the customer's credit report and consider offering them a credit card or other credit product. If the customer continues to demonstrate responsible credit behavior, we may need to consider offering them a higher credit limit or other benefits.",Notify customer of payment frequency increase,Open
A009,CUS009,LOAN009,Credit Limit,2023-08-03,Medium,"The customer's credit limit has been increased by 15% due to their excellent payment history. This is a positive sign of the customer's financial responsibility and may indicate that they are a good candidate for additional credit. The customer should be notified of the credit limit increase and encouraged to continue making timely payments. We should also review the customer's credit report and consider offering them a credit card or other credit product. If the customer continues to demonstrate responsible credit behavior, we may need to consider offering them a higher credit limit or other benefits.",Notify customer of credit limit increase,Open
1002,50001,2001,Overdue Payment,2023-07-25,High,"Mr. John Doe, a 35-year-old male from the United States, has failed to make his loan payment for the month of July. As per the loan agreement, the payment was due on July 15th. This is the second missed payment in the last two months. We kindly request that Mr. Doe settles his outstanding balance of $1500 as soon as possible to avoid any further action. Please contact Mr. Doe to discuss the payment plan. The loan was taken out on March 10th, 2022, with an initial loan amount of $10000 and a monthly payment of $250.",Contact Customer,Open
1003,50002,2002,High Credit Utilization,2023-07-26,Medium,"Mrs. Maria Rodriguez, a 28-year-old female from Mexico, has reached her credit limit on her credit card. Her current balance of $8000 is 85% of her available credit. We recommend that Mrs. Rodriguez reduce her expenses and make a payment to avoid any potential damage to her credit score. The credit card was issued on January 20th, 2022, with a credit limit of $10000. Please advise Mrs. Rodriguez to make a payment of at least $2000 within the next 30 days. If the payment is not made, we will have to report this to the credit bureau. The current interest rate is 20.99%. Please contact Mrs. Rodriguez to discuss the payment plan. ",Contact Customer,Open
1004,50003,2003,Late Payment Fee,2023-07-27,Low,"Mr. Liam Chen, a 42-year-old male from China, has incurred a late payment fee on his loan. The payment was due on July 20th, but it was made on July 25th. The late fee is $25. We recommend that Mr. Chen make his next payment on time to avoid any further fees. The loan was taken out on April 15th, 2022, with an initial loan amount of $8000 and a monthly payment of $200. Please contact Mr. Chen to discuss the payment plan. The current balance is $6500. Please advise Mr. Chen to make a payment of at least $200 within the next 30 days.",Contact Customer,Open
ARL-001,CUS-12345,LNK-001,Overdue Payment,2023-07-25,High,"The account holder, Mr. Kofi Mensah, a 35-year-old Ghanaian resident, has failed to make a payment on his loan. His loan was due on 2023-07-15, and the amount outstanding is $10000. Mr. Mensah has a good credit history and has consistently made payments on time in the past. However, due to unforeseen circumstances, he is currently facing financial difficulties. We kindly request that Mr. Mensah make the payment as soon as possible to avoid any further action.",Contact the customer to discuss payment arrangements,Open
ARL-002,CUS-67890,LNK-002,Credit Limit Exceeded,2023-07-26,Medium,"Mrs. Sofia Rodriguez, a 28-year-old Mexican-American living in the United States, has exceeded her credit limit on her credit card. Her current balance is $5500, which is $2000 above her approved limit. We recommend that Mrs. Rodriguez reduce her spending or make a payment to bring her balance below the limit. Failure to do so may result in late fees and damage to her credit score.",Send a notification to the customer to reduce spending or make a payment,Open
ARL-003,CUS-34567,LNK-003,Late Payment,2023-07-27,Low,"Mr. Jian Li, a 42-year-old Chinese national living in Australia, has made a late payment on his loan. His payment was due on 2023-07-20, and the payment was received on 2023-07-25. Although the payment has been made, we will send a reminder to Mr. Li to ensure he is aware of the payment due date for future payments.",Send a reminder to the customer to be aware of future payment due dates,Open
ARL-004,CUS-90123,LNK-004,Defaulted Loan,2023-07-28,Critical,"Ms. Maria Hernandez, a 29-year-old Puerto Rican living in Spain, has defaulted on her loan. Her loan was due on 2023-07-15, and the amount outstanding is $8000. We have sent several reminders to Ms. Hernandez, but she has failed to make a payment. We will proceed with collection actions to recover the debt.",Proceed with collection actions,Open
ARL-005,CUS-56789,LNK-005,Credit Score Decrease,2023-07-29,Medium,"Mr. Liam Chen, a 38-year-old British national living in Canada, has experienced a decrease in his credit score. His current credit score is 620, which is 50 points lower than his previous score. We recommend that Mr. Chen work on improving his credit habits to improve his credit score.",Recommend to the customer to improve credit habits,Open
1102,54321,21987,Overdue Payment,2024-07-26,High,Customer is 3 days past due on a $1500 loan. Payment is required to avoid further penalties. Please contact the customer to discuss payment arrangements.,Contact Customer,Active
1103,98765,21988,Low Credit Score,2024-07-27,Medium,The customer's credit score has decreased by 50 points in the past 3 months. This may impact their ability to secure future loans. Please review the customer's credit report and provide guidance on improving their credit score.,Review Credit Report,Active
1104,54321,21989,High Credit Utilization,2024-07-28,Low,"The customer's credit utilization ratio is 80%, which is higher than the recommended 30%. Please advise the customer to reduce their credit utilization to avoid further credit score damage.",Advise Customer,Active
1105,98765,21990,Payment Plan Needed,2024-07-29,High,The customer requires a payment plan to cover the next 6 months. Please work with the customer to create a payment plan that meets their financial needs.,Create Payment Plan,Active
1106,12345,21991,Defaulted Loan,2024-07-30,Critical,The customer has defaulted on a $2000 loan. Please initiate collection procedures and work with the customer to resolve the debt.,Initiate Collection,Active
1107,67890,21992,Credit Limit Increase,2024-07-31,Low,The customer's credit limit has been increased by 20%. Please advise the customer on responsible credit usage and encourage them to avoid overspending.,Advise Customer,Active
1108,11111,21993,Overdue Payment,2024-08-01,High,Customer is 5 days past due on a $3000 loan. Payment is required to avoid further penalties. Please contact the customer to discuss payment arrangements.,Contact Customer,Active
1109,22222,21994,Low Credit Score,2024-08-02,Medium,The customer's credit score has decreased by 30 points in the past 6 months. This may impact their ability to secure future loans. Please review the customer's credit report and provide guidance on improving their credit score.,Review Credit Report,Active
1001,CUST_0001,LOAN_0001,Credit Limit Exceeded,2022-01-01,High,The customer's credit limit has been exceeded by $10000. The customer's current balance is $20000 and their credit limit is $10000. Immediate action is required to avoid further charges.,Review customer's account and adjust credit limit if necessary,Active
1002,CUST_0002,LOAN_0002,Payment Overdue,2022-01-15,Medium,The customer's payment for loan LOAN_0002 is overdue by 10 days. The total amount due is $5000. The customer should be contacted to arrange a payment plan.,Contact customer to arrange payment plan,Active
1003,CUST_0003,LOAN_0003,Credit Score Update,2022-02-01,Low,The customer's credit score has been updated to 750. The customer's credit history is satisfactory and they are eligible for a credit limit increase. Please review the customer's account and adjust the credit limit accordingly.,Review customer's account and adjust credit limit if necessary,Active
1004,CUST_0004,LOAN_0004,Loan Application Approved,2022-03-01,High,The customer's loan application LOAN_0004 has been approved. The loan amount is $50000 and the interest rate is 5%. Please contact the customer to arrange the loan details.,Contact customer to arrange loan details,Active
1005,CUST_0005,LOAN_0005,Credit Limit Exceeded,2022-04-01,High,The customer's credit limit has been exceeded by $20000. The customer's current balance is $30000 and their credit limit is $10000. Immediate action is required to avoid further charges. The customer has a history of overspending and may require a payment plan.,"Review customer's account and adjust credit limit if necessary, and contact customer to arrange payment plan",Active
1006,CUST_0006,LOAN_0006,Payment Overdue,2022-05-01,Medium,The customer's payment for loan LOAN_0006 is overdue by 20 days. The total amount due is $10000. The customer should be contacted to arrange a payment plan. The customer has a history of late payments and may require additional assistance.,Contact customer to arrange payment plan and review customer's account for potential assistance,Active
1007,CUST_0007,LOAN_0007,Credit Score Update,2022-06-01,Low,The customer's credit score has been updated to 800. The customer's credit history is excellent and they are eligible for a credit limit increase. Please review the customer's account and adjust the credit limit accordingly. The customer is a resident of Brazil and has a diverse financial history.,Review customer's account and adjust credit limit if necessary,Active
1008,CUST_0008,LOAN_0008,Loan Application Approved,2022-07-01,High,The customer's loan application LOAN_0008 has been approved. The loan amount is $75000 and the interest rate is 6%. Please contact the customer to arrange the loan details. The customer is a resident of India and has a strong credit history.,Contact customer to arrange loan details,Active
1009,CUST_0009,LOAN_0009,Credit Limit Exceeded,2022-08-01,High,The customer's credit limit has been exceeded by $15000. The customer's current balance is $25000 and their credit limit is $10000. Immediate action is required to avoid further charges. The customer has a history of overspending and may require a payment plan. The customer is a resident of Japan and has a diverse financial history.,"Review customer's account and adjust credit limit if necessary, and contact customer to arrange payment plan",Active
1002,12345,98765,High Risk,2023-07-20,3,"The customer's credit score has dropped by 50 points in the last 3 months. This is a high-risk situation as the customer's debt-to-income ratio is now above 50%. The loan officer should review the customer's financial situation and consider adjusting the loan terms to ensure the customer can meet their payments. The customer's financial situation is as follows: They have a monthly income of $5000, and their monthly expenses are $4500. They have 2 credit cards with a balance of $2000 and $1000, and 1 car loan with a balance of $8000. They have been making their payments on time for the past 6 months, but their credit score has been declining steadily. The loan officer should also review the customer's credit report to see if there are any other issues that may be affecting their credit score. The customer should be contacted to discuss their financial situation and come up with a plan to get their credit score back on track. The loan officer should also consider offering the customer a credit counseling service to help them manage their debt. The customer should be informed of the potential risks of defaulting on their loan and the consequences of late payments. The loan officer should also review the customer's loan terms to ensure they are fair and reasonable. The customer should be contacted regularly to monitor their financial situation and make any necessary adjustments to the loan terms.",Contact the customer to discuss their financial situation and come up with a plan to get their credit score back on track.,Open
1001,12345,78901,High Risk,2022-03-01,Critical,"Lorem ipsum dolor sit amet, consectetur adipiscing elit. Sed do eiusmod tempor incididunt ut labore et dolore magna aliqua. Ut enim ad minim veniam, quis nostrud exercitation ullamco laboris nisi ut aliquip ex ea commodo consequat. Duis aute irure dolor in reprehenderit in voluptate velit esse cillum dolore eu fugiat nulla pariatur. Excepteur sint occaecat cupidatat non proident, sunt in culpa qui officia deserunt mollit anim id est laborum. Ut enim ad minim veniam, quis nostrud exercitation ullamco laboris nisi ut aliquip ex ea commodo consequat. Duis aute irure dolor in reprehenderit in voluptate velit esse cillum dolore eu fugiat nulla pariatur. Excepteur sint occaecat cupidatat non proident, sunt in culpa qui officia deserunt mollit anim id est laborum.",Immediate Review,Active
1002,67890,45678,Low Risk,2022-03-02,Low,"At vero eos et accusamus et iusto odio dignissim qui blanditiis praesentium voluptatum deleniti atque corrupti quos dolores et quas molestias excepturi sint occaecati cupiditate non provident, similique sunt in culpa qui officia deserunt mollitia animi, id est laborum et dolorum fuga. Et harum quidem rerum facilis est et expedita distinctio. Nam libero tempore, cum soluta nobis est eligendi optio cumque nihil impedit quo minus id quod maxime placeat facere possimus, omnis voluptas assumenda est, omnis dolor repellendus. Temporibus autem quibusdam et aut officiis debitis aut rerum necessitatibus saepe eveniet ut et voluptates repudiandae sint et molestiae non recusandae.",Review in 3 days,Active
1003,34567,90123,Medium Risk,2022-03-03,Medium,"Fusce a diam sit amet lacus iaculis luctus. Sed sed urna auctor, dictum arcu vel, bibendum ex. Proin in sapien non sapien luctus venenatis vel vel nulla. Cras faucibus purus ut massa malesuada, sed ultrices sapien bibendum. Donec at tellus bibendum, finibus dui in, pulvinar lacus. Sed bibendum, nunc ac dictum viverra, urna dui malesuada arcu, in mollis ex ante sit amet nulla. Aliquam vel malesuada metus. Sed vestibulum ex ut tellus ornare, eget blandit arcu facilisis.",Review in 5 days,Active
1004,90123,23456,High Risk,2022-03-04,Critical,"Mauris rhoncus, ante id posuere rutrum, arcu magna viverra risus, vel imperdiet tellus lacus at libero. Praesent quis justo sit amet dui viverra porta ut in augue. Aenean id sagittis tellus, et viverra ante. Nulla facilisi. Integer auctor lacus in mi congue, et eleifend risus sollicitudin. Cras et justo sit amet erat blandit ornare. Nulla facilisi. Praesent quis justo sit amet dui viverra porta ut in augue. Aenean id sagittis tellus, et viverra ante.",Immediate Review,Active
1005,45678,78901,Low Risk,2022-03-05,Low,"Proin viverra, nisl et blandit gravida, est sapien viverra magna, nec viverra diam urna et arcu. Nullam vel metus quis orci tempor tempor. In vel metus sit amet metus faucibus malesuada. Sed auctor felis quis tellus vestibulum, sed viverra est malesuada. In hac habitasse platea dictumst. Praesent ut sapien sit amet risus accumsan mollis ut in augue. Aenean id sagittis tellus, et viverra ante.",Review in 3 days,Active